guid,title_en,link_en,description_en,pubDate_en,title_fr,link_fr,description_fr,pubDate_fr,pubDate
26168_2025-06-20,"Official Languages for People Management, Directive on",http://www.tbs-sct.canada.ca/pol/doc-eng.aspx?id=26168,"Outlines the requirements related to the linguistic identification of a position, the staffing of bilingual positions, and the equal participation of English-speaking Canadians and French-speaking Canadians in federal institutions.","Fri, 20 Jun 2025 00:00:00 -0400","langues officielles pour la gestion des personnes, Directives sur les",http://www.tbs-sct.canada.ca/pol/doc-fra.aspx?id=26168,"Énonce les exigences relatives à l’identification linguistique des postes, à la dotation des postes bilingues et à la participation équitable des Canadiens d’expression française et ceux d’expression anglaise dans les institutions fédérales.","Fri, 20 Jun 2025 00:00:00 -0400",
26262_2012-11-30,"Authentication Requirements, Guideline on Defining",http://www.tbs-sct.canada.ca/pol/doc-eng.aspx?id=26262,Assists departments and agencies in defining the authentication requirements for delivery of programs and services.,"Fri, 30 Nov 2012 00:00:00 -0500","d'authentification, Ligne directrice sur la définition des exigences en matière",http://www.tbs-sct.canada.ca/pol/doc-fra.aspx?id=26262,Aide les ministères et les organismes à définir les exigences d’authentification aux fins de l’exécution des programmes et de la prestation des services.,"Fri, 30 Nov 2012 00:00:00 -0500",
26295_2012-11-30,Internet Protocol Version 6 (IPv6) Network Equipment Procurement Guideline,http://www.tbs-sct.canada.ca/pol/doc-eng.aspx?id=26295,"Assists departments when procuring network equipment, in support of the Internet Protocol Version 6 Adoption Strategy.","Fri, 30 Nov 2012 00:00:00 -0500","achat d'équipement pour le réseau de la version 6 du protocole Internet (IPv6), Ligne directrice sur l'",http://www.tbs-sct.canada.ca/pol/doc-fra.aspx?id=26295,Aide les ministères lorsqu’ils achètent de l’équipement de réseau afin d’appuyer la stratégie d’adoption de la version 6 du protocole Internet.,"Fri, 30 Nov 2012 00:00:00 -0500",
26332_2013-01-15,"Common Financial Management Business Process 4.1 - Manage Other Capital Assets, Guideline on",http://www.tbs-sct.canada.ca/pol/doc-eng.aspx?id=26332,"This guideline presents the should be model for Manage Other Capital Assets, which involves financial management during the life cycle of a capital asset (excluding real property) that is managed by a department.","Tue, 15 Jan 2013 00:00:00 -0500","processus opérationnel commun en gestion financière 4.1 – Gestion des autres immobilisations, ligne directrice sur le",http://www.tbs-sct.canada.ca/pol/doc-fra.aspx?id=26332,"La présente ligne directrice présente le modèle « souhaité » de la Gestion des autres immobilisations, c’est-à-dire la gestion financière durant le cycle de vie d’une immobilisation (excluant les biens immobiliers) par un ministère.","Tue, 15 Jan 2013 00:00:00 -0500",
26952_2013-05-15,"Common Financial Management Business Process 3.2 – Manage Travel, Guideline on",http://www.tbs-sct.canada.ca/pol/doc-eng.aspx?id=26952,"Constitutes the model for Manage Travel, describing roles, responsibilities and recommended activities from a financial management perspective.","Wed, 15 May 2013 00:00:00 -0400","processus opérationnel commun en gestion financière 3.2 – gestion des voyages, Ligne directrice sur le",http://www.tbs-sct.canada.ca/pol/doc-fra.aspx?id=26952,"Constitue le modèle pour le processus opérationnel de la Gestion des déplacements, et décrit les rôles, les responsabilités et les activités recommandées du point de vue de la gestion financière.","Wed, 15 May 2013 00:00:00 -0400",2013-05-15 00:00:00-04:00
26953_2013-05-15,"Common Financial Management Business Process 1.1 – Manage Planning And Budgeting, Guideline on",http://www.tbs-sct.canada.ca/pol/doc-eng.aspx?id=26953,This guideline presents the should be financial business process for Manage Planning and Budgeting and describes the annual activities that departments would complete in order to develop detailed internal departmental plans and budgets against their voted authorities for the fiscal year.,"Wed, 15 May 2013 00:00:00 -0400","processus opérationnel commun en gestion financière 1.1 – gestion de la planification et de la budgétisation, Ligne directrice sur le",http://www.tbs-sct.canada.ca/pol/doc-fra.aspx?id=26953,"Elle présente le modèle souhaité de la gestion de la planification et de la budgétisation, qui comprend les activités de planification et de budgétisation du ministère en fonction des autorisations votées (p. ex., le crédit des dépenses de fonctionnement, le crédit des dépenses en capital et le crédit des subventions et contributions) pour l’exercice.","Wed, 15 May 2013 00:00:00 -0400",2013-05-15 00:00:00-04:00
26954_2010-05-30,"Common Financial Management Business Process 3.3 - Manage Other Payments, Guideline on",http://www.tbs-sct.canada.ca/pol/doc-eng.aspx?id=26954,"Constitutes the model for Manage Other Payments, which involved common payment transactions not covered by Manage Interdepartmental Settlements (Business Process 2.2), Manage Procure to Payment (Business Process 3.3), Manage Travel (Business Process 3.2), Pay Administration (Business Process 5.1), and Manage Grants and Contributions (Business Process 6.1).","Sun, 30 May 2010 00:00:00 -0400","processus opérationnel commun en gestion financière 3.3 –  Gestion des autres paiements, Ligne directrice sur le",http://www.tbs-sct.canada.ca/pol/doc-fra.aspx?id=26954,"Constitue le modèle pour le processus opérationnel de la Gestion des autres paiements, qui comprend les opérations de paiement communes qui ne sont pas visées par les processus opérationnels de la Gestion des règlements interministériels (2.2), de la Gestion du cycle d’approvisionnement au paiement (3.3), de la Gestion des déplacements (3.2), de la Gestion de l’administration de la paye (5.1) et de la Gestion des subventions et des contributions (6.1).","Sun, 30 May 2010 00:00:00 -0400",2010-05-30 00:00:00-04:00
27146_2020-04-01,"Performance Management, Directive on",http://www.tbs-sct.canada.ca/pol/doc-eng.aspx?id=27146,This directive provides direction to head of human resources and managers on the management of employee performance in the core public administration.,"Wed, 01 Apr 2020 00:00:00 -0400","rendement, Directive sur la gestion de",http://www.tbs-sct.canada.ca/pol/doc-fra.aspx?id=27146,Assure la promotion d’un engagement partagé quant au maintien d’une culture à rendement élevé dans la fonction publique.,"Wed, 01 Apr 2020 00:00:00 -0400",
27228_2020-07-31,"Travel, Hospitality, Conference and Event Expenditures, Directive on",http://www.tbs-sct.canada.ca/pol/doc-eng.aspx?id=27228,"Provides detailed direction on the handling of expenditures for travel, hospitality, conferences and events.","Fri, 31 Jul 2020 00:00:00 -0400","voyages, d’accueil, de conférences et d'événements, Directive sur les dépenses de",http://www.tbs-sct.canada.ca/pol/doc-fra.aspx?id=27228,"Fournit des directives détaillées sur le traitement des dépenses de voyages, d’accueil, de conférences et d’événements.","Fri, 31 Jul 2020 00:00:00 -0400",
27256_2024-03-28,"Chief Financial Officer Attestation for Cabinet Submissions, Guideline on",http://www.tbs-sct.canada.ca/pol/doc-eng.aspx?id=27256,No description provided.,"Thu, 28 Mar 2024 00:00:00 -0400","attestation du dirigeant principal des finances pour les présentations au Cabinet, Ligne directrice sur l’",http://www.tbs-sct.canada.ca/pol/doc-fra.aspx?id=27256,,"Thu, 28 Mar 2024 00:00:00 -0400",
27807_2014-03-31,"Project Brief, Guide to a",http://www.tbs-sct.canada.ca/pol/doc-eng.aspx?id=27807,"Provides guidance in the form of headings, examples and descriptions on the level and type of information required in a project brief by the Treasury Board Policy on the Management of Projects.","Mon, 31 Mar 2014 00:00:00 -0400","présentation des énoncés de projet, Guide de",http://www.tbs-sct.canada.ca/pol/doc-fra.aspx?id=27807,"Fournit des directives sous forme d’en‑têtes, d’exemples et de descriptions sur le niveau et le type de renseignements requis dans un énoncé de projet selon la Politique sur la gestion des projets du Conseil du Trésor.","Mon, 31 Mar 2014 00:00:00 -0400",
27907_2016-05-30,"Acceptable Network and Device Use, Guideline on",http://www.tbs-sct.canada.ca/pol/doc-eng.aspx?id=27907,No description provided.,"Mon, 30 May 2016 00:00:00 -0400","utilisation acceptable des dispositifs et des réseaux, Ligne directrice sur l’",http://www.tbs-sct.canada.ca/pol/doc-fra.aspx?id=27907,,"Mon, 30 May 2016 00:00:00 -0400",2016-05-30 00:00:00-04:00
28108_2014-10-09,"Open Government, Directive on",http://www.tbs-sct.canada.ca/pol/doc-eng.aspx?id=28108,Promotes information management practices that enable the proactive and ongoing release of government information.,"Thu, 09 Oct 2014 00:00:00 -0400","Gouvernement ouvert, Directive sur le",http://www.tbs-sct.canada.ca/pol/doc-fra.aspx?id=28108,Encourage des pratiques de gestion de l’information qui permettent la communication proactive et continue de l’information gouvernementale.,"Thu, 09 Oct 2014 00:00:00 -0400",
28203_2014-11-26,Governance and Expenditure Management Policy Area,http://www.tbs-sct.canada.ca/pol/doc-eng.aspx?id=28203,No description provided.,"Wed, 26 Nov 2014 00:00:00 -0500",Domaine politique de gouvernance et de gestion des dépenses,http://www.tbs-sct.canada.ca/pol/doc-fra.aspx?id=28203,,"Wed, 26 Nov 2014 00:00:00 -0500",
28699_2020-04-01,"Classification Oversight, Directive on",http://www.tbs-sct.canada.ca/pol/doc-eng.aspx?id=28699,"Describes the responsibilities of Heads of Human Resources for the oversight of classification, including Executive classification.","Wed, 01 Apr 2020 00:00:00 -0400","surveillance de la classification, Directive sur la",http://www.tbs-sct.canada.ca/pol/doc-fra.aspx?id=28699,"La directive décrit les responsabilités des chefs des ressources humaines quant à la surveillance de la classification, y compris la classification des cadres supérieurs.","Wed, 01 Apr 2020 00:00:00 -0400",
28700_2021-04-01,"Classification, Directive on",http://www.tbs-sct.canada.ca/pol/doc-eng.aspx?id=28700,"Establishes roles and responsibilities in organizational design and classification for Heads of Human Resources, managers, persons accredited, or trained, in organizational design and classification.","Thu, 01 Apr 2021 00:00:00 -0400","classification, Directive sur la",http://www.tbs-sct.canada.ca/pol/doc-fra.aspx?id=28700,"La directive définit les rôles et les responsabilités en matière de conception organisationnelle et de classification pour les chefs des ressources humaines, les gestionnaires et les personnes accréditées, ou formées, en conception organisationnelle et en classification.","Thu, 01 Apr 2021 00:00:00 -0400",
30656_2016-03-21,"Attribution of Internal Services, Guideline on the",http://www.tbs-sct.canada.ca/pol/doc-eng.aspx?id=30656,"These guidelines update the current guidance that supports the Policy on Management, Resources and Results Structures (MRRS). The objective is to establish consistency in recording and reporting of internal services.","Mon, 21 Mar 2016 00:00:00 -0400","Attribution aux programmes des dépenses liées aux services internes, Ligne directrice sur l’",http://www.tbs-sct.canada.ca/pol/doc-fra.aspx?id=30656,"Ces lignes directrices actualisent l'actuel guide qui appuie la Politique sur la Structure de gestion, des ressources et des résultats (SGRR). Elles ont pour but d'introduire plus de cohérence dans la consignation de l'information sur les services internes et l'établissement de rapports connexes.","Mon, 21 Mar 2016 00:00:00 -0400",
30678_2016-03-04,"Identity Assurance, Guideline on",http://www.tbs-sct.canada.ca/pol/doc-eng.aspx?id=30678,Supports implementation of the minimum requirements for establishing the identity of an individual to a given level of assurance.,"Fri, 04 Mar 2016 00:00:00 -0500","assurance de l’identité, Ligne directrice sur",http://www.tbs-sct.canada.ca/pol/doc-fra.aspx?id=30678,Soutient la mise en œuvre des exigences minimales pour établir l’identité d’une personne à un niveau d’assurance donné.,"Fri, 04 Mar 2016 00:00:00 -0500",
30682_2025-10-30,"Communications and Federal Identity, Directive on the Management of",http://www.tbs-sct.canada.ca/pol/doc-eng.aspx?id=30682,"Provides rules for managing and coordinating communications, including procedures for advertising, public opinion research, social media,  external-facing websites and mobile applications.","Thu, 30 Oct 2025 00:00:00 -0400","communications et de l’image de marque, Directive sur la Gestion des",http://www.tbs-sct.canada.ca/pol/doc-fra.aspx?id=30682,"Prévoit les règles pour la gestion et la coordination des communications, y compris les procédures relatives à la publicité, les recherches sur l’opinion publique, les médias sociaux, les sites Web externes et les applications mobiles.","Thu, 30 Oct 2025 00:00:00 -0400",
30683_2025-10-30,"Communications and Federal Identity, Policy on",http://www.tbs-sct.canada.ca/pol/doc-eng.aspx?id=30683,"Gives context and rules for how the Government of Canada (GC) enables internal and external communication about policies, programs, services and initiatives, including the administration of the GC official symbols.","Thu, 30 Oct 2025 00:00:00 -0400","Communications et l'image de marque, Politique sur les",http://www.tbs-sct.canada.ca/pol/doc-fra.aspx?id=30683,"Présente le contexte et les règles visant les communications internes et externes du gouvernement du Canada (GC) sur les politiques, les programmes, les services et les initiatives, y compris l’administration des symboles officiels du gouvernement du Canada.","Thu, 30 Oct 2025 00:00:00 -0400",
31300_2026-01-19,"Results, Policy on",http://www.tbs-sct.canada.ca/pol/doc-eng.aspx?id=31300,"The Policy on Results sets out the fundamental requirements for Canadian federal departmental accountability for performance information and evaluation, while highlighting the importance of results in management and expenditure decision making, as well as public reporting.","Mon, 19 Jan 2026 00:00:00 -0500","résultats, Politique sur les",http://www.tbs-sct.canada.ca/pol/doc-fra.aspx?id=31300,"La Politique sur les résultats établit les exigences fondamentales de la responsabilité ministérielle fédérale canadienne concernant l’information sur le rendement et l’évaluation, tout en soulignant l’importance des résultats dans la prise de décisions liées à la gestion, aux dépenses et aux rapports publics.","Mon, 19 Jan 2026 00:00:00 -0500",
31306_2025-10-30,"Results, Directive on",http://www.tbs-sct.canada.ca/pol/doc-eng.aspx?id=31306,"Outlines requirements for supporting the implementation of the Policy on Results, including the identification of roles and responsibilities for Canadian federal departmental officials.","Thu, 30 Oct 2025 00:00:00 -0400","résultats, Directive sur les",http://www.tbs-sct.canada.ca/pol/doc-fra.aspx?id=31306,"Énonce les exigences pour favoriser la mise en œuvre de la Politique sur les résultats, y compris la définition des rôles et responsabilités des agents ministériels du gouvernement fédéral canadien.","Thu, 30 Oct 2025 00:00:00 -0400",
32495_2024-06-27,"Financial Management, Policy on",http://www.tbs-sct.canada.ca/pol/doc-eng.aspx?id=32495,"Provides the key responsibilities for Deputy Heads, CFOs, Senior Departmental Managers and the Comptroller General of Canada in exercising effective financial management.","Thu, 27 Jun 2024 00:00:00 -0400","Gestion financière, Politique sur la",http://www.tbs-sct.canada.ca/pol/doc-fra.aspx?id=32495,"Indique les principales responsabilités des administrateurs généraux, des ASAF, des cadres supérieurs du ministère et du contrôleur général du Canada dans l’exercice d’une gestion financière efficace","Thu, 27 Jun 2024 00:00:00 -0400",
32499_2023-11-28,"Accounting Standards, Directive on",http://www.tbs-sct.canada.ca/pol/doc-eng.aspx?id=32499,"Provides the accounting, reporting, and recording framework for the Government of Canada’s consolidated financial statements, departmental financial statements, and quarterly financial reports.","Tue, 28 Nov 2023 00:00:00 -0500","Normes comptables, Directive sur les",http://www.tbs-sct.canada.ca/pol/doc-fra.aspx?id=32499,"Fournit le cadre de comptabilité, de rapport et d’enregistrement pour les états financiers consolidés du gouvernement du Canada, les états financiers des ministères et les rapports financiers trimestriel.","Tue, 28 Nov 2023 00:00:00 -0500",
32502_2024-03-20,"Charging and Special Financial Authorities, Directive on",http://www.tbs-sct.canada.ca/pol/doc-eng.aspx?id=32502,"Outlines management practices and controls to ensure that external and internal charging practices for services provided are consistent across government, the amounts charged respect legislative limits; and the consistent treatment of non-tax revenues that are not returned to the Consolidated Revenue Fund.","Wed, 20 Mar 2024 00:00:00 -0400","L’imputation et les autorisations financières spéciales, Directive sur",http://www.tbs-sct.canada.ca/pol/doc-fra.aspx?id=32502,"Donne un aperçu des pratiques de gestion et des contrôles afin de s'assurer que les pratiques liées aux frais d'utilisation externe et interne pour les services fournis sont uniformes dans l'ensemble du gouvernement, que les montants imputés respectent les limites législatives, et que le traitement des recettes non fiscales, non retournées au Trésor public, est homogène.","Wed, 20 Mar 2024 00:00:00 -0400",
32503_2021-01-18,"Delegation of Spending and Financial Authorities, Directive on",http://www.tbs-sct.canada.ca/pol/doc-eng.aspx?id=32503,"Provides Chief Financial Officers their responsibilities for delegating, maintaining and management and oversight of spending and financial authorities.","Mon, 18 Jan 2021 00:00:00 -0500","Délégation des pouvoirs de dépenser et des pouvoirs financiers, Directive sur la",http://www.tbs-sct.canada.ca/pol/doc-fra.aspx?id=32503,"Fournit les dirigeants principaux des finances les responsabilités pour la délégation, la tenue à jour et la gestion et surveillance de dépenser et des pouvoirs financiers.","Mon, 18 Jan 2021 00:00:00 -0500",
32504_2024-06-27,"Payments, Directive on",http://www.tbs-sct.canada.ca/pol/doc-eng.aspx?id=32504,Outlines the requirements and controls necessary to manage and administer payments.,"Thu, 27 Jun 2024 00:00:00 -0400","Paiements, Directive sur les",http://www.tbs-sct.canada.ca/pol/doc-fra.aspx?id=32504,Donne un aperçu des exigences et des contrôles nécessaires pour gérer et administrer les paiements.,"Thu, 27 Jun 2024 00:00:00 -0400",
32505_2017-04-01,"Public Money and Receivables, Directive on",http://www.tbs-sct.canada.ca/pol/doc-eng.aspx?id=32505,"Requirements and controls for the effective and efficient management of public money and receivables in order to minimize the risk of loss, error, fraud or improper consumption.","Sat, 01 Apr 2017 00:00:00 -0400","Gestion des fonds publics et des comptes débiteurs, Directive sur la",http://www.tbs-sct.canada.ca/pol/doc-fra.aspx?id=32505,"Exigences et contrôles pour la gestion efficace et efficiente des fonds publics et des comptes débiteurs afin de minimiser le risque de perte, d’erreur, de fraude ou d’utilisation problématique.","Sat, 01 Apr 2017 00:00:00 -0400",
32533_2023-10-24,"Internal Audit, Directive on",http://www.tbs-sct.canada.ca/pol/doc-eng.aspx?id=32533,The Directive on Internal Audit supports the objectives of the Policy on Internal Audit by setting out the responsibilities for Chief Audit Executives related to internal audit and providing the mandatory procedures for internal auditing in the Government of Canada that supplement the Institute of Internal Auditors Professional Practices Framework. The Directive also provides the mandatory attributes of the composition and the operations of Departmental Audit Committees and details on requirements for their operations.,"Tue, 24 Oct 2023 00:00:00 -0400","Audit interne, Directive sur l’",http://www.tbs-sct.canada.ca/pol/doc-fra.aspx?id=32533,"La Directive sur l’audit interne appui les objectifs de la Politique sur l’audit interne en établissant les responsabilités des dirigeants principaux de l’audit qui s’appliquent à l’audit interne ainsi que les procédures obligatoires relatives à l’audit interne au gouvernement du Canada, qui s’ajoutent au Cadre international de référence des pratiques professionnelles de l’Institut des auditeurs internes. De plus, la directive établit les critères de composition et d’opération obligatoires des comités d’audit ministériels ainsi que les détails des exigences liées à leurs opérations.","Tue, 24 Oct 2023 00:00:00 -0400",
32563_2024-10-03,"Reporting of Grants and Contributions Awards, Guidelines on the",http://www.tbs-sct.canada.ca/pol/doc-eng.aspx?id=32563,The Guidelines on the Reporting of Grants and Contributions Awards sets out the public requirements for the Proactive Disclosure of Grants and Contributions. It increases transparency of government funding provided through Grants and Contributions.,"Thu, 03 Oct 2024 00:00:00 -0400","divulgation des octrois de subventions et de contributions, Lignes directrices sur la",http://www.tbs-sct.canada.ca/pol/doc-fra.aspx?id=32563,Les Lignes directrices sur la divulgation des octrois de subventions et de contributions énoncent les exigences publiques qui ont trait à la divulgation proactive des subventions et des contributions. Elles augmentent la transparence du financement gouvernemental octroyé par des subventions et des contributions.,"Thu, 03 Oct 2024 00:00:00 -0400",
32573_2022-11-14,"Green Procurement, Policy on",http://www.tbs-sct.canada.ca/pol/doc-eng.aspx?id=32573,"This policy requires that the procurement of goods and services actively promote environmental stewardship and should be read in conjunction with the <em><a href=""https://www.canada.ca/en/treasury-board-secretariat/services/innovation/greening-government/strategy.html"">Greening Government Strategy: A Government of Canada Directive</a></em>.","Mon, 14 Nov 2022 00:00:00 -0500","achats écologiques, Politique d'",http://www.tbs-sct.canada.ca/pol/doc-fra.aspx?id=32573,"Cette politique exige que l’approvisionnement de biens et services favorise activement la gestion responsable de l’environnement et doit être lue conjointement avec la <em><a href=""https://www.canada.ca/fr/secretariat-conseil-tresor/services/innovation/ecologiser-gouvernement/strategie.html"">Stratégie pour un gouvernement vert : Une directive du gouvernement du Canada</a></em>.","Mon, 14 Nov 2022 00:00:00 -0500",
32574_2019-05-09,"Crown Corporations on Preparing Corporate Plans and Budgets, Guidance for",http://www.tbs-sct.canada.ca/pol/doc-eng.aspx?id=32574,"This guidance will help parent Crown corporations prepare corporate plans and budgets, and summaries of and amendments to those plans and budgets.","Thu, 09 May 2019 00:00:00 -0400","Sociétés d’État sur la préparation des plans d’entreprise et des budgets, Guide pour les",http://www.tbs-sct.canada.ca/pol/doc-fra.aspx?id=32574,"Le présent guide a pour objet d’aider les sociétés d’État mères à préparer les plans d’entreprise et les budgets, ainsi que les résumés et les modifications de ces documents.","Thu, 09 May 2019 00:00:00 -0400",2019-05-09 00:00:00-04:00
32590_2023-08-17,"Personal Information Requests and Correction of Personal Information, Directive on",http://www.tbs-sct.canada.ca/pol/doc-eng.aspx?id=32590,Provides direction to government institutions on how to respond to personal information requests.,"Thu, 17 Aug 2023 00:00:00 -0400","demandes de renseignements personnels et de correction des renseignements personnels, Directive sur les",http://www.tbs-sct.canada.ca/pol/doc-fra.aspx?id=32590,Fournit une orientation aux institutions gouvernementales sur la façon de répondre aux demandes d’accès à des renseignements personnels.,"Thu, 17 Aug 2023 00:00:00 -0400",
