guid,title_en,link_en,description_en,pubDate_en,title_fr,link_fr,description_fr,pubDate_fr,pubDate
12084_2007-05-23,"Compensation, Policy Framework for the Management of",http://www.tbs-sct.canada.ca/pol/doc-eng.aspx?id=12084,"This framework sets out specific principles and an approach to managing compensation within the federal public administration. The framework guides Treasury Board ministers in their role as financial and human resources managers, set out in section 7 of the Financial Administration Act (FAA).","Wed, 23 May 2007 00:00:00 -0400","rémunération, Cadre des politiques de gestion de la",http://www.tbs-sct.canada.ca/pol/doc-fra.aspx?id=12084,"Le cadre établit les principes précis et l'approche utilisés pour gérer la rémunération au sein de l'administration publique fédérale. Il guide les ministres du Conseil du Trésor dans leur rôle de gestionnaires des ressources financières et humaines, au sens du paragraphe 7 de la Loi sur la gestion des finances publiques (LGFP).","Wed, 23 May 2007 00:00:00 -0400",2007-05-23 00:00:00-04:00
12111_1995-07-07,"Educational Assistance for Children of Employees, Policy on",http://www.tbs-sct.canada.ca/pol/doc-eng.aspx?id=12111,Assists employees with unexpected costs incurred for their children’s public education.,"Fri, 07 Jul 1995 00:00:00 -0400","assistance scolaire pour les enfants d'employés, Politique sur l'",http://www.tbs-sct.canada.ca/pol/doc-fra.aspx?id=12111,Aide les employés à payer les coûts imprévus engagés pour l’enseignement public de leurs enfants.,"Fri, 07 Jul 1995 00:00:00 -0400",
12129_1991-11-01,Performance pay for represented employees in the Administrative and Foreign Service Category,http://www.tbs-sct.canada.ca/pol/doc-eng.aspx?id=12129,"Applies to employees in the public service as specified in Part I, Schedule I, the Public Service Staff Relations Act who are classified at senior levels in the administrative and foreign service categories and who are subject to a collective agreement for which a performance pay range has been negotiated.","Fri, 01 Nov 1991 00:00:00 -0400",Rémunération au rendement pour les employés représentés de la catégorie de l'administration et du service extérieur,http://www.tbs-sct.canada.ca/pol/doc-fra.aspx?id=12129,"S’applique aux employés de la fonction publique, tel que précisé à la partie I de l’annexe I de la Loi sur les relations de travail dans la fonction publique, qui sont classifiés à un niveau supérieur dans la catégorie d’administration et de service extérieur et qui sont assujettis à une convention collective dans laquelle on a négocié une échelle de rémunération au rendement.","Fri, 01 Nov 1991 00:00:00 -0400",
12139_1992-10-01,Injury on Duty Leave,http://www.tbs-sct.canada.ca/pol/doc-eng.aspx?id=12139,"Explains that employees who are disabled due to an occupational illness have a right to injury-on-duty leave with full normal pay for such reasonable period, as the employer so determines, where a provincial workers’ compensation board confirms the disability pursuant to the Government Employees Compensation Act.","Thu, 01 Oct 1992 00:00:00 -0400",Congé pour accident du travail,http://www.tbs-sct.canada.ca/pol/doc-fra.aspx?id=12139,"Explique que les employés qui sont handicapés en raison d’une maladie professionnelle ont droit à un congé pour accident du travail et à leur plein salaire pour une période raisonnable fixée par l’employeur, lorsque l’invalidité est confirmée par une commission provinciale des accidents du travail en vertu de la Loi sur l’indemnisation des agents de l’État.","Thu, 01 Oct 1992 00:00:00 -0400",
12141_2005-04-01,"Two-Tier Bargaining, Guidelines for",http://www.tbs-sct.canada.ca/pol/doc-eng.aspx?id=12141,"Permits the parties to use flexible approaches in negotiating collective agreements. The adoption of such approaches is voluntary and, thus, subject to the agreement of the employer and the bargaining agent.","Fri, 01 Apr 2005 00:00:00 -0400","négociation à deux niveaux, Lignes directrices sur la",http://www.tbs-sct.canada.ca/pol/doc-fra.aspx?id=12141,"Permet aux parties d’adopter des approches souples au regard de la négociation des conventions collectives. L’adoption de telles approches est facultative et, par conséquent, elle dépend de l’accord de l’employeur et de l’agent négociateur.","Fri, 01 Apr 2005 00:00:00 -0400",
12143_2015-08-13,Workers' Compensation,http://www.tbs-sct.canada.ca/pol/doc-eng.aspx?id=12143,"Explains that provincial workers compensation boards adjudicate compensation claims under the Government Employees Compensation Act pursuant to an administrative agreement with each board, and that the payment of benefits occurs according to the rates and conditions provided under the provincial compensation acts.","Thu, 13 Aug 2015 00:00:00 -0400","indemnisation pour accident du travail, L'",http://www.tbs-sct.canada.ca/pol/doc-fra.aspx?id=12143,"Explique que les commissions provinciales des accidents du travail étudient les demandes d’indemnisation en vertu de la Loi sur l’indemnisation des agents de l’État, conformément à l’entente administrative conclue avec chaque commission, et que le paiement des prestations se fait en fonction des conditions et des taux prévus dans les lois provinciales sur l’indemnisation des accidents du travail.","Thu, 13 Aug 2015 00:00:00 -0400",
12453_2023-06-28,"Access to Information, Policy on",http://www.tbs-sct.canada.ca/pol/doc-eng.aspx?id=12453,Provides direction to government institutions for effectively and consistently administering the Access to Information Act and Regulations.,"Wed, 28 Jun 2023 00:00:00 -0400","accès à l'information, Politique sur l'",http://www.tbs-sct.canada.ca/pol/doc-fra.aspx?id=12453,Offre de l’orientation aux institutions gouvernementales sur l’administration efficace et uniforme de la Loi sur l’accès à l’information et de son Règlement.,"Wed, 28 Jun 2023 00:00:00 -0400",
12510_2024-11-08,"Privacy Protection, Policy on",http://www.tbs-sct.canada.ca/pol/doc-eng.aspx?id=12510,This policy provides direction to government institutions to ensure compliance with the <em>Privacy Act</em>.,"Fri, 08 Nov 2024 00:00:00 -0500","protection de la vie privée, Politique sur la",http://www.tbs-sct.canada.ca/pol/doc-fra.aspx?id=12510,La présente politique fournit des orientations aux institutions fédérales afin d’assurer le respect de la <em>Loi sur la protection des renseignements personnels</em>.,"Fri, 08 Nov 2024 00:00:00 -0500",
12553_2020-04-01,"Interchange Canada, Directive on",http://www.tbs-sct.canada.ca/pol/doc-eng.aspx?id=12553,This directive details key stakeholders’ responsibilities regarding fair and consistent management of Interchange Canada assignments.,"Wed, 01 Apr 2020 00:00:00 -0400","Échanges Canada, Directive sur",http://www.tbs-sct.canada.ca/pol/doc-fra.aspx?id=12553,La directive décrit en détail les responsabilités des principaux intervenants quant à la gestion équitable et uniforme des affectations Échanges Canada.,"Wed, 01 Apr 2020 00:00:00 -0400",
12563_1992-02-01,"Liaison with Private Contractors, Procedures for",http://www.tbs-sct.canada.ca/pol/doc-eng.aspx?id=12563,"Complements occupational health and safety procedures, and provides a basis for the development by departments and agencies of detailed internal processes, as required, for dealing with outside contractors.","Sat, 01 Feb 1992 00:00:00 -0500","liaison avec les entrepreneurs privés, Procédures pour la",http://www.tbs-sct.canada.ca/pol/doc-fra.aspx?id=12563,"Complète les procédures de santé et de sécurité au travail, et établit une base pour l’élaboration, par les ministères et les organismes, de processus internes détaillés, le cas échéant, pour faire affaire avec des entrepreneurs externes.","Sat, 01 Feb 1992 00:00:00 -0500",
12583_2024-03-21,"Terms and Conditions of Employment for Students, Directive on",http://www.tbs-sct.canada.ca/pol/doc-eng.aspx?id=12583,"This directive outlines the responsibilities of organizations within the core public administration (CPA) to ensure accurate, consistent, effective and equitable administration of the terms and conditions of employment for students.","Thu, 21 Mar 2024 00:00:00 -0400","Conditions d’emploi pour les étudiants, Directive sur les",http://www.tbs-sct.canada.ca/pol/doc-fra.aspx?id=12583,"Cette directive décrit les responsabilités des organisations au sein de l’administration publique centrale (APC) afin d’assurer l’administration rigoureuse, uniforme, efficace et équitable des conditions d’emploi des étudiants.","Thu, 21 Mar 2024 00:00:00 -0400",
12588_2025-01-07,Self-Funded Leave Policy,http://www.tbs-sct.canada.ca/pol/doc-eng.aspx?id=12588,"Details criteria for self-funded leave in the federal public service, including a generic model to be used, as well as procedures, guidelines and the name of the approved financial institution.","Tue, 07 Jan 2025 00:00:00 -0500","congé auto-financé, Politique sur le",http://www.tbs-sct.canada.ca/pol/doc-fra.aspx?id=12588,"Fournit des détails sur les critères pour les congés autofinancés dans la fonction publique fédérale, y compris un modèle générique à utiliser, ainsi que des procédures, des lignes directrices et le nom de l'institution financière approuvée.","Tue, 07 Jan 2025 00:00:00 -0500",
12595_2005-04-01,Co-development Guidelines,http://www.tbs-sct.canada.ca/pol/doc-eng.aspx?id=12595,"Describes and clarifies the concept of co-developing workplace improvements that the employer and bargaining agents have at their disposal in order to work together, with some considerations for their use.","Fri, 01 Apr 2005 00:00:00 -0400",amélioration conjointe du milieu de travail - Lignes directrices sur l',http://www.tbs-sct.canada.ca/pol/doc-fra.aspx?id=12595,"Décrit et met au clair la notion d’amélioration concertée du milieu de travail que l’employeur et les agents négociateurs ont à leur disposition pour travailler en collaboration, et fournit certains éléments à considérer.","Fri, 01 Apr 2005 00:00:00 -0400",
12601_2005-04-01,"Labour-Management Consultation Committees, Guidelines for",http://www.tbs-sct.canada.ca/pol/doc-eng.aspx?id=12601,"Elaborates on how good labour-management relations matter greatly for good human resources management. Consultation, through sustained communication between management and bargaining agents, can contribute to the enhancement of the relationships between the parties.","Fri, 01 Apr 2005 00:00:00 -0400","comités consultatifs patronaux-syndicaux, Lignes directrices sur les",http://www.tbs-sct.canada.ca/pol/doc-fra.aspx?id=12601,"Explique en quoi les bonnes relations patronales‑syndicales sont essentielles pour assurer la bonne gestion des ressources humaines. La consultation, par une communication continue entre la direction et les agents négociateurs, peut contribuer au renforcement des relations entre les parties.","Fri, 01 Apr 2005 00:00:00 -0400",
12602_2005-04-11,"Managerial or Confidential Exclusions, Guidelines on",http://www.tbs-sct.canada.ca/pol/doc-eng.aspx?id=12602,Gives instructions about proposing positions for exclusion from a bargaining unit.,"Mon, 11 Apr 2005 00:00:00 -0400","postes de direction ou de confiance exclus, Lignes directrices sur les",http://www.tbs-sct.canada.ca/pol/doc-fra.aspx?id=12602,Fournit des directives sur la proposition d’exclusion de postes d’une unité de négociation.,"Mon, 11 Apr 2005 00:00:00 -0400",
12607_1995-05-01,"Strikes, Policy on",http://www.tbs-sct.canada.ca/pol/doc-eng.aspx?id=12607,Ensures an effective employer response to strikes in the federal public service.,"Mon, 01 May 1995 00:00:00 -0400","grèves, Politiques sur les",http://www.tbs-sct.canada.ca/pol/doc-fra.aspx?id=12607,Assure une réaction efficace de l’employeur en cas de grève dans la fonction publique fédérale.,"Mon, 01 May 1995 00:00:00 -0400",1995-05-01 00:00:00-04:00
12610_2005-04-01,"Use of Employer Facilities, Guidelines for",http://www.tbs-sct.canada.ca/pol/doc-eng.aspx?id=12610,Clarifies the provisions of the Public Service Labour Relations Act regarding exceptions to unfair labour practices as they relate to the use of employer facilities.,"Fri, 01 Apr 2005 00:00:00 -0400","utilisation des installations de l'employeur, Lignes directrices sur l'",http://www.tbs-sct.canada.ca/pol/doc-fra.aspx?id=12610,Offre des précisions sur les dispositions de la Loi sur les relations de travail dans la fonction publique en ce qui concerne les exceptions aux pratiques déloyales de travail qui s’appliquent à l’utilisation des installations de l’employeur.,"Fri, 01 Apr 2005 00:00:00 -0400",
12614_2001-10-11,Workplace Day Care Centres,http://www.tbs-sct.canada.ca/pol/doc-eng.aspx?id=12614,Assist employees who need daycare for their children so they can pursue careers in the federal public service.,"Thu, 11 Oct 2001 00:00:00 -0400",Garderies en milieu de travail,http://www.tbs-sct.canada.ca/pol/doc-fra.aspx?id=12614,Aide les employés qui ont besoin de services de garderie pour leurs enfants afin de leur permettre d’entreprendre une carrière au sein de la fonction publique fédérale.,"Thu, 11 Oct 2001 00:00:00 -0400",
13342_2023-11-15,"Social Insurance Number, Directive on",http://www.tbs-sct.canada.ca/pol/doc-eng.aspx?id=13342,"Provides direction to government institutions on how the social insurance number (SIN) can be collected, used and disclosed, as well as methods to establish policy authority for a new collection or new consistent use of the SIN.","Wed, 15 Nov 2023 00:00:00 -0500","numéro d'assurance sociale, Directive sur le",http://www.tbs-sct.canada.ca/pol/doc-fra.aspx?id=13342,"Fournit une orientation aux institutions gouvernementales sur la façon dont le numéro d’assurance sociale (NAS) peut être recueilli, utilisé et divulgué, et propose des méthodes permettant d’obtenir l’autorisation stratégique en vue d’une nouvelle collecte ou d’une nouvelle utilisation uniforme du NAS.","Wed, 15 Nov 2023 00:00:00 -0500",
13525_2024-12-20,"Transfer Payments, Policy on",http://www.tbs-sct.canada.ca/pol/doc-eng.aspx?id=13525,"Explains the roles, responsibilities and accountabilities for the management of transfer payment programs.","Fri, 20 Dec 2024 00:00:00 -0500","paiements de transfert, Politique sur les",http://www.tbs-sct.canada.ca/pol/doc-fra.aspx?id=13525,"Explique les rôles, les responsabilités et les obligations en matière de gestion des programmes de paiements de transfert.","Fri, 20 Dec 2024 00:00:00 -0500",
13583_2023-04-14,Public Service Income Benefit Plan for Survivors of Employees Slain on Duty,http://www.tbs-sct.canada.ca/pol/doc-eng.aspx?id=13583,"Provides guarantees to the spouse and children of employees whose death occurred due to an act of violence unlawfully committed by another person or other persons, occurring in the course of or arising out of the performance of their employment-related duties.","Fri, 14 Apr 2023 00:00:00 -0400",Régime de prestations de revenu versées aux survivants des employés de la fonction publique tués dans l'exercice de leurs fonctions,http://www.tbs-sct.canada.ca/pol/doc-fra.aspx?id=13583,"Offre une garantie de revenu au conjoint et aux enfants des employés dont le décès a été causé par un acte de violence commis illégalement par une ou plusieurs personnes, et ce, dans l’exercice de leurs fonctions ou en raison de celles‑ci.","Fri, 14 Apr 2023 00:00:00 -0400",
13589_1992-10-01,Flying Accidents Compensation,http://www.tbs-sct.canada.ca/pol/doc-eng.aspx?id=13589,"Provides for the payment of compensation to employees or their dependants where injury or death directly results from a non-scheduled flight in the course of duty or, in the case of a civil aviation inspector, where injury or death directly results from any flight taken for the purpose of conducting a flight test or monitoring commercial air operations on that flight.","Thu, 01 Oct 1992 00:00:00 -0400","indemnisation en cas d'accidents d'aviation, L'",http://www.tbs-sct.canada.ca/pol/doc-fra.aspx?id=13589,"Prévoit l’indemnisation de l’employé ou de ses personnes à charge lorsque la blessure ou le décès est la conséquence directe d’un vol non régulier entrepris par l’employé dans l’exercice de ses fonctions ou, dans le cas d’un inspecteur de l’aviation civile, lorsque la blessure ou le décès est la conséquence directe d’un vol entrepris aux fins d’un essai en vol ou d’un contrôle des opérations de services aériens en vol.","Thu, 01 Oct 1992 00:00:00 -0400",
13616_2008-06-24,Foundation Framework for Treasury Board Policies,http://www.tbs-sct.canada.ca/pol/doc-eng.aspx?id=13616,Explains the structure of Treasury Board policy instruments and outlines general requirements common to all Treasury Board policy instruments.,"Tue, 24 Jun 2008 00:00:00 -0400",Cadre principal des politiques du Conseil du Trésor,http://www.tbs-sct.canada.ca/pol/doc-fra.aspx?id=13616,Explique la structure des instruments de politique du Conseil du Trésor et énonce les exigences générales communes pour tous les instruments de politique du Conseil du Trésor.,"Tue, 24 Jun 2008 00:00:00 -0400",
13697_2022-09-14,"Title to Intellectual Property Arising Under Crown Procurement Contracts, Policy on",http://www.tbs-sct.canada.ca/pol/doc-eng.aspx?id=13697,The objective of this policy is to increase the potential for Commercial Exploitation of Intellectual Property developed by a Contractor in the course of a Crown Procurement Contract.,"Wed, 14 Sep 2022 00:00:00 -0400","titre de propriété intellectuelle découlant des marchés d'acquisition de l'État, Politique sur le",http://www.tbs-sct.canada.ca/pol/doc-fra.aspx?id=13697,La présente politique vise à accroître les possibilités d'exploitation commerciale de la propriété intellectuelle créée par un entrepreneur dans le cadre d'un marché d'acquisition de l'État.,"Wed, 14 Sep 2022 00:00:00 -0400",
13848_1992-10-01,Long-Term Disability Insurance,http://www.tbs-sct.canada.ca/pol/doc-eng.aspx?id=13848,"Provides an overview of long-term disability insurance coverage under the Public Service Management Insurance Plan, a mandatory plan that provides a 70% income benefit to participants who cannot work for a long period of time due to illness or injury resulting in total disability.","Thu, 01 Oct 1992 00:00:00 -0400",Assurance-invalidité de longue durée,http://www.tbs-sct.canada.ca/pol/doc-fra.aspx?id=13848,"Donne un aperçu de la couverture d’assurance‑invalidité de longue durée en vertu du Régime d’assurance pour les cadres de gestion de la fonction publique, un régime obligatoire qui offre une prestation de revenu de 70 p. 100 aux participants qui ne peuvent pas travailler pendant une longue période de temps en raison d’une maladie ou d’une blessure entraînant une invalidité totale.","Thu, 01 Oct 1992 00:00:00 -0400",
13890_1996-07-16,Termination of Employment of Public Service Employees Due to Alternative Delivery Situations (Policy),http://www.tbs-sct.canada.ca/pol/doc-eng.aspx?id=13890,Fairly and openly facilitates the transfer of staff to new employers in the case of alternative delivery initiatives.,"Tue, 16 Jul 1996 00:00:00 -0400",Licenciement de fonctionnaires dû à la diversification des modes d'exécution (politique),http://www.tbs-sct.canada.ca/pol/doc-fra.aspx?id=13890,Facilite le transfert équitable et transparent de personnel à de nouveaux employeurs dans le cadre d’initiatives de diversification des modes d’exécution.,"Tue, 16 Jul 1996 00:00:00 -0400",
13937_2023-01-30,"Legal Assistance and Indemnification, Policy on",http://www.tbs-sct.canada.ca/pol/doc-eng.aspx?id=13937,"Establishes the framework to provide legal assistance and indemnification to Crown servants and matters greatly for the protection of the Crown’s interest, the fair treatment of its employees, and the effective management of an organization.","Mon, 30 Jan 2023 00:00:00 -0500","services juridiques et l'indemnisation, Politique sur les",http://www.tbs-sct.canada.ca/pol/doc-fra.aspx?id=13937,"Établit le cadre pour fournir des services juridiques et une indemnisation aux fonctionnaires de l’État qui sont essentiels pour la protection des intérêts de l’État, le traitement équitable de ses employés et la gestion efficace d’une organisation.","Mon, 30 Jan 2023 00:00:00 -0500",
13953_1991-11-01,"Service outside Canada, Policy on",http://www.tbs-sct.canada.ca/pol/doc-eng.aspx?id=13953,Provides special terms and conditions of employment for personnel serving outside Canada.,"Fri, 01 Nov 1991 00:00:00 -0400","service à l'extérieur du Canada, Politique sur le",http://www.tbs-sct.canada.ca/pol/doc-fra.aspx?id=13953,Établit les conditions d’emploi particulières des fonctionnaires en poste à l’extérieur du Canada.,"Fri, 01 Nov 1991 00:00:00 -0400",
13954_2026-03-11,"Staff engaged locally outside Canada, Policy on",http://www.tbs-sct.canada.ca/pol/doc-eng.aspx?id=13954,Provides terms and conditions of employment for locally engaged staff employed outside Canada.,"Wed, 11 Mar 2026 00:00:00 -0400",Personnel recruté sur place à l'étranger,http://www.tbs-sct.canada.ca/pol/doc-fra.aspx?id=13954,Établit les conditions d’emploi du personnel recruté sur place à l’étranger.,"Wed, 11 Mar 2026 00:00:00 -0400",
14208_2024-12-20,"Transfer Payments, Directive on",http://www.tbs-sct.canada.ca/pol/doc-eng.aspx?id=14208,Provides departmental managers with the operational requirements for the design and delivery of transfer payment programs.,"Fri, 20 Dec 2024 00:00:00 -0500","paiements de transfert, Directive sur les",http://www.tbs-sct.canada.ca/pol/doc-fra.aspx?id=14208,Fournit aux gestionnaires ministériels les exigences opérationnelles nécessaires pour la conception et l’exécution des programmes de paiements de transfert.,"Fri, 20 Dec 2024 00:00:00 -0500",
14219_2023-07-08,"Executive (EX) Group Organization and Classification, Directive on",http://www.tbs-sct.canada.ca/pol/doc-eng.aspx?id=14219,The directive describes the requirements for the organization and classification of positions in the Executive Group in the core public administration.,"Sat, 08 Jul 2023 00:00:00 -0400","organisation et la classification du groupe de la direction (EX), Directive sur l'",http://www.tbs-sct.canada.ca/pol/doc-fra.aspx?id=14219,La directive décrit les exigences relatives à l’organisation et à la classification des postes du Groupe de la direction de l’administration publique centrale.,"Sat, 08 Jul 2023 00:00:00 -0400",
14265_2024-09-26,"Streamlining - Statutory Reports to Parliament, Guidelines on",http://www.tbs-sct.canada.ca/pol/doc-eng.aspx?id=14265,Assists departmental officials as well as Treasury Board of Canada Secretariat officials in the interpretation and application of section 157 of the Financial Administration Act.,"Thu, 26 Sep 2024 00:00:00 -0400","rationalisation des rapports prévus par la loi et déposés devant le Parlement, Lignes directrices sur la",http://www.tbs-sct.canada.ca/pol/doc-fra.aspx?id=14265,Aide les agents ministériels ainsi que les agents du Secrétariat du Conseil du Trésor du Canada à interpréter et à appliquer l’article 157 de la Loi sur la gestion des finances publiques.,"Thu, 26 Sep 2024 00:00:00 -0400",
15772_2020-01-23,"Terms and Conditions of Employment, Directive on",http://www.tbs-sct.canada.ca/pol/doc-eng.aspx?id=15772,"Directs departments and agencies that will ensure the equitable, accurate, consistent, transparent and timely application of terms and conditions of employment across the core public administration.","Thu, 23 Jan 2020 00:00:00 -0500","conditions d’emploi, Directive sur les",http://www.tbs-sct.canada.ca/pol/doc-fra.aspx?id=15772,"Fournit aux ministères et organismes l’orientation qui assurera l’application équitable, exacte, uniforme, transparente et opportune des conditions d’emploi dans l’ensemble de l’administration publique centrale.","Thu, 23 Jan 2020 00:00:00 -0500",
15773_2021-11-15,"Terms and Conditions of Employment for Certain Excluded and Unrepresented Groups and Levels, Directive on",http://www.tbs-sct.canada.ca/pol/doc-eng.aspx?id=15773,"The directive provides direction to managers and designated senior officials to ensure the sound, consistent, effective, and equitable administration of the terms and conditions of employment for persons occupying certain excluded and unrepresented positions across the core public administration, where the terms and conditions of employment of such positions differ from those provided in the relevant collective agreement, or in any other Treasury Board policy instrument related to employment terms and conditions.","Mon, 15 Nov 2021 00:00:00 -0500","Conditions d’emploi de certains groupes et niveaux exclus et non représentés, Directive sur les",http://www.tbs-sct.canada.ca/pol/doc-fra.aspx?id=15773,"La directive donne des orientations aux gestionnaires et aux cadres supérieurs désignés pour garantir une administration saine, uniforme, efficace et équitable des conditions d’emploi des personnes qui occupent certains postes exclus et sous-représentés dans l’ensemble de l’administration publique centrale et dont les conditions d’emploi sont différentes de celles prévues dans la convention collective pertinente ou tout autre instrument de politique du Conseil du Trésor se rapportant aux conditions d’emploi.","Mon, 15 Nov 2021 00:00:00 -0500",
